tool_name,description,parameter_count,parameters
fetch_youtube_transcript,Extract auto-generated subtitles from a YouTube video (free).,3,url|language|kwargs
find_similar_exa,Find pages semantically similar to a given URL (Exa).,3,url|n|kwargs
research_ab_test_analyze,Analyze A/B test results with statistical significance and Cohen's d effect size.,3,results_a|results_b|metric
research_ab_test_design,Design A/B test with power and minimum detectable effect.,4,strategy_a|strategy_b|sample_size|metric
research_adapt_complexity,Adjust text complexity to target reading level (1-20 scale; 12 = college).,2,content|target_reading_level
research_adaptive_reframe,Adaptively reframe based on refusal analysis and model fingerprinting.,3,prompt|refusal_text|model
research_adversarial_batch,Batch craft adversarial examples for multiple inputs.,3,inputs|method|budget
research_adversarial_debate,Simulate multi-turn adversarial debate: attacker vs target model.,4,topic|attacker_strategy|max_turns|target_model
research_adversarial_robustness,Test model robustness against adversarial inputs.,2,target_url|test_count
research_agent_benchmark,Benchmark an AI agent against 20 agentic prompt injection scenarios.,4,model_api_url|model_name|timeout|output_format
research_aggregate_results,Combine multiple tool results into unified output.,2,results|strategy
research_aggregate_texts,Aggregate multiple text outputs.,3,texts|method|max_length
research_ai_compliance_check,Check a website for AI compliance indicators.,2,domain|frameworks
research_ai_detect,Detect whether text is likely AI-generated.,2,text|max_cost_usd
research_alert_check,Evaluate all rules against current metric values.,1,metric_values
research_alert_create,Create an alerting rule.,5,name|metric|condition|threshold|action
research_alert_list,List all alert rules.,0,none
research_amass_enum,Attack surface mapping and asset discovery via OWASP Amass enum.,3,domain|passive|timeout
research_amass_intel,OSINT intelligence gathering via OWASP Amass intel.,1,domain
research_api_changelog,Return changelog of features added/changed between versions.,1,since_version
research_api_deprecations,List deprecated tools/features scheduled for removal.,0,none
research_api_version,Return current API version info with system metadata.,0,none
research_archive_page,Archive a complete webpage as a single HTML file using SingleFile.,2,url|output_dir
research_article_batch,Batch extract articles from multiple URLs with concurrency control.,2,urls|max_concurrent
research_article_extract,Extract article content; metadata; and NLP features from URL.,1,url
research_artifact_cleanup,List forensic artifacts that WOULD be cleaned (dry-run only for safety).,2,target_paths|os_type
research_arxiv_extract_techniques,Extract actionable attack techniques from a paper abstract.,2,paper_abstract|paper_title
research_arxiv_ingest,Search arXiv for recent papers on jailbreaking/red-teaming/prompt injection.,3,keywords|days_back|max_papers
research_arxiv_scan,Search arXiv for recent papers on jailbreak/adversarial/safety topics.,3,keywords|days_back|max_papers
research_ask_all_llms,Send a prompt to ALL available LLM providers and compare responses.,3,prompt|max_tokens|include_reframe
research_ask_all_models,Send a prompt to ALL available AI models and compare responses.,6,prompt|models|max_tokens|auto_reframe|include_clis|timeout
research_attack_portfolio,Build diversified attack portfolio using portfolio theory.,2,target_model|portfolio_size
research_attack_score,Score attack effectiveness across 8 dimensions.,5,prompt|response|strategy|model|baseline_refusal
research_attractor_trap,Generate prompts that trap safety evaluators in chaotic oscillations.,3,prompt|attractor_type|iterations
research_audio_extract,Extract audio from video URL.,2,url|format
research_audit_export,Export audit trail for compliance review.,2,format|days
research_audit_query,Query audit trail entries with filtering and time window.,4,tool|caller|since_hours|limit
research_audit_record,Record an audit trail entry for a tool call.,5,tool_name|params|result_summary|caller|duration_ms
research_augment_dataset,Augment dataset samples with transformations.,2,samples|augmentation
research_auth_create_token,Create a bearer token for MCP access.,2,name|expires_hours
research_auth_revoke,Revoke token(s) by name (prefix-based not supported for security).,2,token_prefix|name
research_auth_validate,Validate a token.,1,token
research_author_clustering,Detect emerging research clusters by analyzing co-authorship patterns.,2,field|max_authors
research_authority_stack,Stack multiple authority signals to overwhelm safety filters.,2,prompt|authority_layers
research_auto_params,Auto-infer tool parameters from natural language query.,2,tool_name|query
research_auto_pipeline,Auto-generate optimal multi-tool pipeline from a natural language goal.,3,goal|max_steps|optimize_for
research_auto_redteam,Automatically test strategies against a target model.,3,target_model|strategies_to_test|topic
research_auto_reframe,Auto-reframe a prompt through escalating strategies until accepted.,4,prompt|target_url|model|max_attempts
research_backup_create,Create a backup of Loom's persistent data.,1,target
research_backup_list,List available backups with metadata.,0,none
research_backup_restore,Restore from a backup.,3,backup_id|target|dry_run
research_behavioral_fingerprint,Build behavioral fingerprint from public activity patterns.,1,username
research_benchmark_compare,Compare two tools head-to-head. Returns {tool_a: {mean_ms; p95_ms}; tool_b: {mean_ms; p95_ms}; winner; speedup_factor}.,3,tool_a|tool_b|iterations
research_benchmark_run,Benchmark tool execution speed. Returns {tools_benchmarked; results: [{tool; iterations; min_ms; max_ms; mean_ms; p50_ms; p95_ms}]; total_time_ms}.,3,tools|iterations|warmup
research_bias_lens,Detect methodological bias in academic papers.,2,paper_id|text
research_bias_probe,Test an LLM API for demographic bias.,2,target_url|categories
research_billing_report,Aggregate LLM usage and costs from local cost tracker logs.,1,days
research_bot_detector,Detect coordinated bot/spam behavior on social platforms.,2,subreddit|hn_query
research_botasaurus,Fetch a URL using Botasaurus stealth browser (second stealth escalation).,4,url|session|screenshot|timeout
research_botnet_tracker,Track botnet C2 infrastructure via threat feeds.,2,ioc|ioc_type
research_bpj_generate,Generate boundary points for safety classifier testing.,6,safe_prompt|unsafe_prompt|max_steps|model_name|mode|perturbations
research_breach_check,Check if an email appears in known data breaches.,1,email
research_breaker_reset,Manually reset circuit(s) to CLOSED.,1,provider
research_breaker_status,Show circuit breaker state: {circuits: [{provider; state; failures; last_failure; cooldown_remaining_s}]},0,none
research_breaker_trip,Record failure for provider. Open circuit if failures >= threshold (5).,2,provider|error
research_browser_fingerprint,Analyze browser fingerprinting vectors on a webpage.,2,url|timeout
research_browser_fingerprint_audit,Analyze a URL's fingerprinting scripts (detect canvas/WebGL/audio fingerprinting code).,1,url
research_build_query,Transform a raw user request into optimized research queries.,6,user_request|context|output_type|max_queries|optimize|darkness_level
research_cache_clear,Remove cache entries older than N days.,1,older_than_days
research_cache_lookup,Look up cached response for similar query.,1,query
research_cache_stats,Return cache statistics.,0,none
research_cache_store,Store a query-response pair in memory cache.,4,query|response|tool_name|ttl_hours
research_cached_strategy,Check cache for best strategy on this topic+model combination.,3,topic|model|fallback_strategy
research_camoufox,Fetch a URL using Camoufox stealth browser.,4,url|session|screenshot|timeout
research_capability_mapper,Map LLM capabilities across multiple domains.,2,target_url|categories
research_capability_matrix,Analyze all tool functions by input/output type.,1,category
research_capture_har,Capture HTTP traffic as HAR format.,3,url|duration_seconds|include_bodies
research_career_trajectory,Build a career trajectory profile by combining multiple data sources.,2,person_name|domain
research_censorship_detector,Detect DNS censorship and takedown notices.,1,url
research_censys_host,Look up host on Censys — TLS certs; services; protocols.,1,ip
research_censys_search,Search Censys for hosts matching criteria.,2,query|max_results
research_cert_analyze,Extract SSL/TLS certificate information from a remote server.,3,hostname|domain|port
research_chain_define,Define a reusable tool chain (pipeline).,2,name|steps
research_chain_describe,Show details of a specific chain.,1,name
research_chain_list,List all defined chains with metadata.,0,none
research_challenge_create,Create a new challenge for users to attempt.,4,name|target_model|success_criteria|reward_credits
research_challenge_list,List challenges filtered by status (active; completed; all).,1,status
research_change_monitor,Monitor a web page for meaningful content changes.,2,url|store_result
research_changelog_generate,Generate changelog from git log with conventional commit parsing.,2,since|format
research_changelog_stats,Get git statistics for the project.,1,days
research_checkpoint_list,List checkpoints with filtering. Removes entries >7 days old.,1,status
research_checkpoint_resume,Retrieve checkpoint.,1,task_id
research_checkpoint_save,Save checkpoint. Atomically upserts task state.,3,task_id|state|progress_pct
research_chronos_reverse,Reverse-engineer causality chains from a described future breakthrough.,3,future_state|domain|steps_back
research_cicd_run,Run red-team CI/CD test suite against a model endpoint.,7,config_path|model_endpoint|test_prompts|strategies|max_concurrent|api_key|report_format
research_cipher_mirror,Monitor paste sites for leaked credentials and model weights.,4,query|n|entropy_threshold|max_cost_usd
research_circuit_bypass_plan,Generate bypass strategy for a safety circuit.,2,model|target_circuit
research_citation_analysis,Analyze citation networks for anomalies using Semantic Scholar API.,2,paper_id|depth
research_citation_cartography,Map citation flow with manipulation detection.,2,paper_id|depth
research_citation_graph,Build a citation graph from a seed paper query.,3,paper_query|depth|max_papers
research_cloud_enum,Check cloud resource existence for a domain by probing common patterns.,1,domain
research_code_switch_attack,Code-switching attack: mix languages to confuse tokenizers.,3,prompt|languages|technique
research_coevolve,Co-evolve attacks and defenses discovering novel vectors.,4,seed_attack|seed_defense|generations|population_size
research_commit_analyzer,Analyze GitHub commit patterns for intelligence signals.,2,repo|days_back
research_community_sentiment,Get practitioner sentiment from HackerNews and Reddit.,2,query|n
research_company_diligence,Deep company analysis for job seekers.,1,company_name
research_competitive_intel,Analyze company competitive positioning via weak signal fusion.,3,company|domain|github_org
research_compliance_check,Check text against compliance frameworks (EU AI Act; GDPR; OWASP; NIST; HIPAA).,2,text|frameworks
research_conference_arbitrage,Analyze conference acceptance patterns using DBLP and Semantic Scholar.,1,conference
research_config_check,Check if config has changed since watch started and reload if needed.,1,config_path
research_config_diff,Show what changed between old and new config.,1,key
research_config_get,Return current runtime config. If ``key`` is given; return only that entry.,1,key
research_config_set,Validated runtime config update. Returns ``{error: ...}`` on failure.,2,key|value
research_config_watch,Start watching config.json for modifications.,1,config_path
research_consensus,Run query across all search engines; score results by consensus.,3,query|providers|n
research_consensus_build,MCP tool: Build consensus across multiple models.,4,prompt|target_model|excluded_models|llm_cascade_order
research_consensus_pressure,MCP tool: Apply consensus pressure to target model.,5,prompt|consensus_text|consensus_models|target_model|llm_cascade_order
research_consistency_pressure,Build a prompt with consistency pressure references.,3,model|target_prompt|max_references
research_consistency_pressure_history,Get model's compliance history and stats.,1,model
research_consistency_pressure_record,Record a model's response for future pressure building.,4,model|prompt|response|complied
research_constraint_optimize,Find reframed prompt satisfying multiple constraints simultaneously.,4,prompt|constraints|max_iterations|target_model
research_content_authenticity,Verify that content hasn't been modified using Wayback Machine.,1,url
research_context_clear,Clear context variables.,1,scope
research_context_get,Get context variable(s).,1,key
research_context_poison,Execute many-shot context poisoning attack on an LLM endpoint.,6,target_query|endpoint_url|num_examples|domain|model_name|use_direct_model_fn
research_context_set,Set a context variable.,3,key|value|scope
research_convert_document,Convert documents (PDF; DOCX; HTML; etc.) to markdown or text.,2,url|output_format
research_coverage_run,Run comprehensive test coverage across all 227+ MCP tools.,3,tools_to_test|timeout|dry_run
research_craft_adversarial,Minimally perturb benign input to trigger target behavior from model.,4,benign_input|target_output|perturbation_budget|method
research_crawl,Crawl a website starting from URL; following links matching pattern.,5,url|max_pages|pattern|extract_links|use_js
research_credential_monitor,Check if credentials have been exposed in known data breaches.,2,target|target_type
research_creepjs_audit,Privacy baseline assessment using creepjs fingerprinting.,2,target_url|headless
research_crescendo_chain,Generate a multi-turn Crescendo escalation chain.,3,prompt|turns|model
research_crescendo_loop,Crescendo HCS loop — escalate until response quality meets target.,5,query|target_hcs|max_attempts|model|dry_run
research_critical_path,Find critical path (longest dependency chain) and parallel opportunities.,1,tasks
research_crypto_risk_score,Evaluate cryptocurrency wallet risk.,2,address|chain
research_crypto_trace,Trace cryptocurrency address activity using public blockchain APIs.,3,address|chain|include_transactions
research_cultural_reframe,Reframe prompts using culture-specific persuasion patterns.,3,prompt|culture|language
research_culture_dna,Analyze company culture from public signals.,2,company|domain
research_curriculum,Generate a multi-level learning path from ELI5 to PhD.,2,topic|max_cost_usd
research_cve_detail,Get detailed information for a specific CVE.,1,cve_id
research_cve_lookup,Search CVE database using NVD API (free; rate limited).,2,query|limit
research_daisy_chain,Execute query across multiple models via daisy-chain decomposition.,6,query|available_models|combiner_model|timeout_per_model|max_sub_queries|include_execution_trace
research_danger_prescore,Analyze prompt danger BEFORE sending to any model.,1,prompt
research_dark_cti,Aggregate dark web and public CTI feeds for threat intelligence.,3,query|sources|max_results
research_dark_forum,Aggregate dark web forum intelligence from 4+ sources.,2,query|max_results
research_dark_market_monitor,Monitor dark market activity from public sources.,1,keywords
research_dark_web_bridge,Find clearnet references to dark web content.,1,query
research_darkweb_early_warning,Monitor dark web sources for early warning signals.,2,keywords|hours_back
research_dashboard,Real-time attack visualization dashboard.,4,action|event_type|event_data|since
research_dashboard_html,Generate self-contained HTML health dashboard for Loom server.,0,none
research_data_fabrication,Apply GRIM test and Benford analysis to detect data fabrication.,1,numbers
research_data_poisoning,Detect training data contamination via canary phrase responses.,2,target_url|canary_phrases
research_dead_content,Query multiple archive/cache sources for deleted web content.,3,url|include_snapshots|max_sources
research_dead_drop_scanner,Probe ephemeral .onion sites and capture content with reuse detection.,2,urls|interval_minutes
research_deception_detect,Detect deceptive or fraudulent content using linguistic cues.,1,text
research_deception_job_scan,Analyze job posting for deception signals.,2,job_url|job_text
research_deep,Full-pipeline deep research using all available tools.,17,query|depth|include_domains|exclude_domains|start_date|end_date|language|provider_config|search_providers|expand_queries|extract|synthesize|include_github|include_community|include_red_team|include_misinfo_check|max_cost_usd
research_deepfake_checker,Check image authenticity using EXIF analysis and Error Level Analysis.,1,image_url
research_deer_flow,Run multi-agent research using DeerFlow orchestration.,4,query|depth|max_agents|timeout
research_defend_test,Test system prompt defenses by simulating attacks (blue-team mode).,3,system_prompt|attack_categories|num_attacks
research_defi_security_audit,Audit DeFi smart contract for vulnerabilities.,1,contract_address
research_deleted_social,Recover deleted social media content from archives.,1,url
research_dependency_audit,Audit a GitHub repository's dependencies for risks.,1,repo_url
research_deploy_history,Show deployment history from ~/.loom/deploy_history.jsonl.,1,limit
research_deploy_record,Record deployment event to ~/.loom/deploy_history.jsonl.,4,commit_hash|tool_count|duration_seconds|status
research_deploy_status,Check deployment status: service; port; uptime; memory; health.,0,none
research_detect_anomalies,Detect numerical anomalies using zscore; iqr; or isolation methods.,3,data|method|threshold
research_detect_arabic,Detect if text contains Arabic and suggest provider routing.,1,text
research_detect_language,Detect the language of text content (free; no API key).,1,text
research_detect_paradox,Scan prompt for self-referential paradoxes that confuse safety evaluators.,1,prompt
research_detect_text_anomalies,Detect unusual text patterns (length; vocabulary; structure; encoding).,2,texts|baseline
research_diff_compare,Compare two text outputs and show unified diff.,3,text_a|text_b|context_lines
research_diff_track,Track a tool's output over time to detect drift.,3,tool_name|output|run_id
research_discord_intel,Gather OSINT intelligence on Discord public servers and invites.,3,server_id|invite_code|query
research_dlq_list,List items in the Dead Letter Queue.,1,status
research_dlq_push,Push failed tool call to Dead Letter Queue.,4,tool_name|params|error|retry_count
research_dlq_retry,Retry DLQ items by ID or all pending items past next_retry time.,1,item_id
research_dns_leak_check,Check if DNS queries leak real IP (simulated check).,1,dns_server
research_dns_lookup,DNS lookup for domain records.,2,domain|record_types
research_do,Execute a plain English instruction as a research tool call.,1,instruction
research_docs_ai,Query documentation using DocsGPT API.,4,query|docs_url|timeout|language
research_docs_coverage,Report documentation coverage for all tools.,0,none
research_document_analyze,Unified document analysis — auto-detects file type and applies appropriate parser.,2,file_path_or_url|analysis
research_document_extract,Extract structured content from any document type.,3,file_path|url|strategy
research_domain_reputation,Aggregate domain reputation from multiple threat intelligence sources.,1,domain
research_drift_monitor,Monitor model behavioral drift over time.,4,prompts|model_name|mode|storage_path
research_drift_monitor_list,List all stored drift monitor baselines by model.,1,storage_path
research_email_breach,Hunt for email in breach databases and paste sites.,2,email|search_timeout
research_email_report,Send research results via Gmail SMTP.,4,to|subject|body|html
research_embedding_collide,Craft text that collides in embedding space with hidden payload.,3,target_text|malicious_payload|method
research_engine_batch,Batch fetch multiple URLs with per-URL escalation.,1,params
research_engine_extract,Fetch + selector/LLM-powered structured data extraction.,1,params
research_engine_fetch,Fetch URL with automatic backend escalation.,1,params
research_ensemble_attack,Combine multiple attack techniques for adversarial robustness.,4,prompt|strategies|combination_method|max_strategies
research_env_inspect,Inspect the full runtime environment.,0,none
research_env_requirements,Check if all required dependencies are installed.,0,none
research_epistemic_score,Score epistemic confidence for claims in text.,2,text|claims_to_verify
research_error_clear,Clear error history and reset tracking.,0,none
research_error_stats,Get error statistics from all wrapped tools.,0,none
research_ethereum_tx_decode,Decode Ethereum transaction from etherscan.io.,1,tx_hash
research_evidence_pipeline,MCP tool wrapper for evidence-first reframe pipeline.,4,query|search_provider|reframe_strategy|model_provider
research_evolve_strategies,Evolve prompt reframing strategies using genetic algorithms.,5,seed_strategies|population_size|generations|mutation_rate|test_prompt
research_exif_extract,Extract EXIF metadata from image URLs or file paths.,1,url_or_path
research_experiment_design,Design experiment plan: variables; sample size; expected power; execution steps.,2,research_question|budget
research_explain_bypass,Explain WHY a strategy works on a model (root cause analysis).,3,strategy|target_model|response_text
research_exploit_register,Register a discovered exploit.,5,model|strategy|description|severity|asr
research_exploit_search,Search exploits by model; severity; or keyword.,3,model|severity|query
research_exploit_stats,Return comprehensive exploit statistics.,0,none
research_export_csv,Export list of dicts as CSV.,2,data|filename
research_export_json,Export research data as JSON file.,3,data|filename|pretty
research_export_list,List all exported files.,1,limit
research_extract_actionables,Extract actionable items from any text.,1,text
research_extract_cookies,Extract cookies set by a URL with security assessment.,2,url|follow_redirects
research_fact_check,Verify a claim across multiple fact-checking sources.,2,claim|max_sources
research_fetch,Fetch a URL with configurable strategy.,14,url|mode|max_chars|solve_cloudflare|headers|user_agent|proxy|cookies|accept_language|wait_for|return_format|timeout|bypass_cache|auto_escalate
research_find_experts,Find top experts on a topic by cross-referencing multiple sources.,2,query|n
research_find_tools_by_capability,Filter capability matrix by input type; category; network requirement; or speed.,4,input_type|category|requires_network|speed
research_fingerprint_behavior,Build a personality vector for an LLM model via behavioral probes.,2,model|probe_count
research_fingerprint_evasion_test,Test fingerprint randomization effectiveness across multiple iterations.,2,anonymizer_config|test_iterations
research_fingerprint_model,Fingerprint which LLM family generated a response.,1,response_text
research_flag_check,Check if a feature flag is enabled.,1,flag_name
research_flag_list,List all feature flags and their status.,0,none
research_flag_toggle,Enable or disable a feature flag.,3,flag_name|enabled|description
research_foia_tracker,Track FOIA requests and documents across multiple sources.,1,query
research_format_report,Format raw LLM output into structured report.,2,raw_text|format
research_format_smuggle,Reframe a prompt using format smuggling to bypass content-level filters.,3,prompt|format_type|model
research_forum_cortex,Analyze dark web forum discourse on a topic.,3,topic|n|max_cost_usd
research_full_pipeline,Execute complete research pipeline end-to-end.,6,query|darkness_level|max_models|target_hcs|max_escalation_attempts|output_format
research_full_spectrum,Run full-spectrum red-team pipeline: analyze → reframe → query → score → report.,7,query|model_name|target_hcs|reframing_strategy|include_multi_strategy|include_report|include_recommendations
research_functor_translate,Translate exploit across domains using category-theoretic functors.,4,exploit|source_domain|target_domain|preserve_structure
research_funding_pipeline,Track full grant→patent→hiring pipeline.,1,company_or_field
research_funding_signal,Detect hiring signals from funding/growth indicators.,2,company|domain
research_fuse_evidence,Fuse evidence from multiple sources into unified authoritative document.,3,claims|sources|fusion_method
research_generate_docs,Generate auto-documentation for all registered tools.,2,output_format|include_params
research_generate_redteam_dataset,Generate synthetic red-team evaluation datasets.,4,category|count|difficulty|format
research_generate_report,Auto-generate a structured research report.,3,topic|depth|sections
research_geodesic_path,Measure minimum transformation steps between prompt styles.,4,start_prompt|target_style|max_steps|step_size
research_geoip_local,Look up geographic information for an IP address using local MaxMind database.,1,ip
research_get_best_model,Get model with LOWEST refusal rate.,1,topic
research_ghost_protocol,Detect coordinated activity across platforms by checking temporal correlation.,2,keywords|time_window_minutes
research_ghost_weave,Build temporal hyperlink graph of .onion hidden services.,3,seed_url|depth|max_pages
research_github,Search GitHub via public REST API.,8,kind|query|sort|order|limit|language|owner|repo
research_github_readme,Fetch a repository's README content.,2,owner|repo
research_github_releases,Fetch recent releases for a repository.,3,owner|repo|limit
research_github_secrets,Search GitHub for accidentally committed secrets using code search API.,2,query|max_results
research_gpt_researcher,Run autonomous research and generate a report.,4,query|report_type|max_sources|include_tavily
