tool_name,description,parameter_count,parameters
research_grant_forensics,Apply Zipf's Law and Benford's Law to grant abstract text.,2,grant_id|text
research_graph_analyze,Analyze graph using PageRank; community detection; centrality; or shortest_path.,3,nodes|edges|algorithm
research_graph_query,Search and traverse the graph database. Returns {query; matches; paths; subgraph {nodes; edges}; path_count},2,query|max_depth
research_graph_scrape,Scrape a URL using LLM-powered graph extraction.,3,url|query|model
research_graph_store,Store entities and relationships in graph database. Returns {nodes_created; edges_created; total_nodes; total_edges; timestamp},2,entities|relationships
research_graph_visualize,Return ego-graph (1-hop neighbors) around an entity. Returns {center; nodes; edges; node_count; edge_count},1,entity
research_hallucination_benchmark,Test a model for hallucination via fact-checking.,2,target_url|facts
research_harden_prompt,Suggest hardening improvements for a system prompt.,2,system_prompt|vulnerabilities
research_harvest,Discover emails; subdomains; and IPs for a domain using theHarvester.,3,domain|sources|limit
research_hcs_escalate,Escalate response HCS via adaptive strategy application.,4,prompt|response|target_hcs|max_attempts
research_hcs_report,Generate HCS distribution reports and detect regressions.,3,report_type|regression_threshold|data_path
research_hcs_rubric,Access formalized HCS scoring rubric for calibration and validation.,4,action|score|response|responses_with_scores
research_hcs_score,Score text response on Helpfulness Compliance Score (HCS 1-10).,2,text|query
research_health_check,Return comprehensive server health status for monitoring.,0,none
research_health_deep,Deep health check with resource usage metrics.,0,none
research_help,Get help documentation for Loom tools.,1,tool_name
research_hierarchical_research,Execute hierarchical multi-agent research on a query.,4,query|depth|max_sources|model
research_hitl_evaluate,Record human evaluation of a strategy's output.,4,eval_id|score|notes|tags
research_hitl_queue,List evaluations awaiting human review.,2,status|limit
research_hitl_submit,Submit a strategy+response pair for human evaluation.,4,strategy|prompt|response|model
research_holographic_encode,Split text into fragments to test RAG content detection robustness.,3,text|fragments|method
research_hub_feed,Get team feed of recent findings.,2,type_filter|limit
research_hub_share,Share a finding with the team.,5,finding_type|title|content|tags|visibility
research_hub_vote,Upvote (1) or downvote (-1) a finding.,2,finding_id|vote
research_identity_resolve,Link online identities using only public data.,5,query|query_type|check_gravatar|check_pgp|check_github
research_ideological_drift,Track how a research field's beliefs change over time using keyword evolution.,2,field|years
research_image_analyze,Analyze images using Google Cloud Vision API.,3,image_url|features|max_results
research_influence_operation,Detect potential influence operations via coordinated posting patterns.,1,topic
research_info_half_life,Estimate URL survival rate and information decay half-life.,1,urls
research_information_cascade,Map information flow across platforms (HN; Reddit; arXiv; Wikipedia).,2,topic|hours_back
research_infra_correlator,Correlate infrastructure fingerprints to link related or hidden services.,5,domain|check_favicon|check_analytics|check_certs|check_http
research_inspect_tool,Return full signature info for a tool.,1,tool_name
research_instagram,Download Instagram profile info and recent posts.,2,username|max_posts
research_institutional_decay,Assess institutional health from retraction rate; publication trend; and author turnover.,1,institution
research_integration_test,Import and validate all tool modules load and respond correctly.,2,modules|timeout_ms
research_intelowl_analyze,Analyze observable using IntelOwl's 100+ threat intelligence analyzers.,3,observable|observable_type|analyzers
research_interview_prep,Generate tailored interview preparation materials.,3,job_description|company|interview_type
research_interviewer_profiler,Build a comprehensive profile of a potential interviewer from public data.,2,person_name|company
research_invisible_web,Discover unindexed web content by exploring robots.txt; sitemaps; hidden paths; and JS endpoints.,6,domain|check_robots|check_sitemap|check_hidden_paths|check_js_endpoints|max_paths
research_ioc_enrich,Enrich any IOC (IP; domain; hash; URL) from multiple free sources.,2,ioc|ioc_type
research_ip_geolocation,Get geolocation for an IP address (lightweight; free).,1,ip
research_ip_reputation,Check IP reputation using free APIs (no API key needed).,1,ip
research_jailbreak_evolution_adapt,Suggest strategy adaptations based on evolution analysis.,2,strategy|model
research_jailbreak_evolution_get,Get evolution of a jailbreak strategy across model versions.,2,strategy|model
research_jailbreak_evolution_patches,Detect model patches against jailbreak strategies.,1,model
research_jailbreak_evolution_record,Record a jailbreak attack result with model version info.,6,strategy|model|model_version|success|hcs|timestamp
research_jailbreak_evolution_stats,Export evolution tracking statistics.,1,model
research_jailbreak_evolution_timeline,Get model safety timeline across all jailbreak strategies.,1,model
research_jailbreak_library,Maintain and test jailbreak pattern library.,2,target_url|test_category
research_job_market,Aggregate job market intelligence for a role.,2,role|location
research_job_search,Search job listings across multiple free sources.,4,query|location|remote_only|limit
research_journal_add,Add entry to journal. Categories: finding; hypothesis; experiment; insight; todo; milestone.,4,title|content|tags|category
research_journal_search,Search journal entries by query and/or category. Returns {entries; total}.,3,query|category|limit
research_journal_timeline,Timeline aggregated by week. Returns {timeline; total_entries; active_weeks}.,1,months
research_js_intel,Extract intelligence from JavaScript bundles on a web page.,3,url|max_js_files|check_source_maps
research_kb_search,Search knowledge base matching query against key + content.,3,query|category|limit
research_kb_stats,Return knowledge base statistics.,0,none
research_kb_store,Store knowledge in the base.,4,key|content|category|tags
research_key_rotate,Hot-swap an API key without restart.,2,provider|new_key
research_key_status,Check status of all configured API keys.,0,none
research_key_test,Test if an API key is valid via health check.,1,provider
research_knowledge_extract,Extract knowledge graph entities and relationships from text.,2,text|entity_types
research_knowledge_graph,Build a knowledge graph from research data.,3,query|max_nodes|sources
research_leaderboard,Show strategy leaderboard ranked by metric (total_bypasses; avg_asr; unique_models_bypassed; stealth_score; novelty_score). Periods: today; week; month; all_time.,3,metric|period|limit
research_leak_scan,Scan for data exposure across ethical public sources.,2,target|target_type
research_legal_takedown,Monitor legal takedowns against a domain.,1,domain
research_lifetime_predict,Predict jailbreak longevity before publishing.,4,strategy_name|strategy_text|target_models|is_public
research_lightpanda_batch,Batch fetch multiple URLs using Lightpanda AI browser.,5,urls|javascript|wait_for|extract_links|timeout
research_lightpanda_fetch,Fetch and extract content from a page using Lightpanda AI browser.,4,url|javascript|wait_for|extract_links
research_linkedin_intel,Gather OSINT intelligence on LinkedIn public profiles and companies.,3,company|person|query
research_list_notebooks,List all Joplin notebooks.,0,none
research_llm_answer,Synthesize an answer from multiple sources with citations.,6,question|sources|max_tokens|style|model|provider_override
research_llm_chat,Raw pass-through to LLM chat endpoint.,6,messages|model|max_tokens|temperature|response_format|provider_override
research_llm_classify,Classify text into one or more categories from an allow-list.,5,text|labels|multi_label|model|provider_override
research_llm_embed,Generate embeddings for semantic similarity / deduping.,3,texts|model|provider_override
research_llm_extract,Extract structured data from text using schema.,4,text|schema|model|provider_override
research_llm_query_expand,Expand a query into n related queries for broader search.,4,query|n|model|provider_override
research_llm_summarize,Summarize text using an LLM.,5,text|max_tokens|model|language|provider_override
research_llm_translate,Translate text between languages (Arabic ↔ English first-class).,5,text|target_lang|source_lang|model|provider_override
research_log_query,Query structured logs with filtering.,4,level|tool|limit|since_minutes
research_log_stats,Return log statistics: level counts; top erroring tools; requests/minute.,0,none
research_mac_randomize,Generate and show MAC address randomization (dry-run by default).,2,interface|dry_run
research_maigret,Search for a username across 2000+ services using Maigret.,2,username|timeout
research_malware_intel,Cross-reference malware hash across multiple threat intelligence sources.,1,hash_value
research_map_research_to_product,Map PhD research expertise to commercial products and companies.,2,research_description|n
research_markdown,Extract clean LLM-ready markdown via Crawl4AI with optional CSS subtree,14,url|bypass_cache|css_selector|js_before_scrape|screenshot|remove_selectors|headers|user_agent|proxy|cookies|accept_language|timeout|extract_selector|wait_for
research_market_velocity,Measure how fast a skill/technology is growing in the job market.,2,skill|location
research_masscan,Fast port scan using masscan.,4,target|ports|rate|timeout
research_massdns_resolve,Resolve domains in bulk using massdns high-performance resolver.,5,domains|resolver_file|timeout|record_type|output_format
research_mcp_security_scan,Scan Loom's MCP tools for poisoning and injection vulnerabilities.,1,tool_specs
research_memetic_simulate,Simulate how an idea/strategy would spread through a virtual population.,4,idea|population_size|generations|mutation_rate
research_memorization_scanner,Detect training data memorization by testing verbatim completion.,2,target_url|test_count
research_memory_gc,Force garbage collection and report freed memory.,0,none
research_memory_profile,Profile which objects are using the most memory.,1,top_n
research_memory_recall,Retrieve relevant memories using graph-based similarity search.,3,query|namespace|top_k
research_memory_stats,Return persistent memory statistics.,0,none
research_memory_status,Report current memory usage of the Loom server process.,0,none
research_memory_store,Store content in persistent knowledge graph for long-term memory.,3,content|metadata|namespace
research_meta_learn,Analyze patterns in strategies and generate new hybrids.,4,successful_strategies|failed_strategies|target_model|num_generate
research_metadata_forensics,Extract all hidden metadata from a web page and its resources.,3,url|extract_exif|max_images
research_metadata_strip,Strip EXIF/metadata from images and documents (dry-run simulation).,2,file_path|strip_type
research_metrics,Return Prometheus-compatible metrics for Grafana dashboard.,0,none
research_migrate_backup,Create backup of database before migration.,1,database
research_migrate_run,Run pending migrations on SQLite databases.,2,database|dry_run
research_migrate_status,Check migration status of all SQLite databases in ~/.loom.,0,none
research_misinfo_check,Stress test a claim by generating false variants and checking sources.,3,claim|n_sources|max_cost_usd
research_misp_lookup,Search for indicator in MISP instance.,4,indicator|indicator_type|misp_url|include_related
research_model_comparator,Compare multiple LLM API endpoints side-by-side.,2,prompt|endpoints
research_model_evidence,MCP tool wrapper for model-output-as-evidence pipeline.,4,query|source_model_names|target_model_name|max_evidence_sources
research_model_fingerprint,Identify which LLM model is behind an API endpoint.,2,target_url|probes
research_model_integrity,Check model file integrity for tampering indicators.,3,model_name|source|checks
research_model_profile,Profile model weaknesses for EU AI Act Article 15 compliance testing.,4,model_name|mode|compare_models|query
research_model_sentiment,Detect the emotional state of an LLM from its response text.,2,response|context
research_model_vulnerability_profile,Get the vulnerability profile and optimal attack strategies for a model.,1,model
research_monoculture_detect,Detect research field monoculture via method diversity analysis.,2,field|max_papers
research_multi_consensus,Query multiple LLM providers in parallel and synthesize consensus.,4,question|models|min_agreement|max_tokens
research_multi_page_graph,Scrape multiple pages and build a unified knowledge graph.,2,urls|query
research_multi_search,Query 10+ search engines simultaneously and return unified; deduplicated;,3,query|engines|max_results
research_multilingual,Search in multiple languages for cross-lingual information arbitrage.,4,query|languages|n_per_lang|max_cost_usd
research_multilingual_attack,Apply multilingual attack techniques to bypass safety filters.,3,prompt|technique|languages
research_narrative_tracker,Track narrative propagation across platforms.,2,topic|hours_back
research_network_map,Map network relationships between domains/IPs.,2,targets|depth
research_network_persona,Analyze social network structure within forum data.,2,posts|min_interactions
research_network_visualize,Generate visualization from graph data.,3,nodes|edges|format
research_nightcrawler_status,Return status of the NIGHTCRAWLER monitoring system.,0,none
research_nmap_scan,Port scan using nmap.,3,target|ports|scan_type
research_nodriver_extract,Extract DOM elements from a page by CSS selector or XPath.,4,url|css_selector|xpath|timeout
research_nodriver_fetch,Fetch a URL using async undetected Chrome browser.,6,url|wait_for|timeout|screenshot|bypass_cache|max_chars
research_nodriver_session,Manage persistent browser sessions.,5,action|session_name|url|css_selector|xpath
research_notify_history,Retrieve notification history from JSONL file.,2,limit|severity
research_notify_rules,Manage notification rules for auto-alerts.,2,action|rule
research_notify_send,Send notification to log/email/slack channel.,4,channel|title|message|severity
research_ocr_advanced,Extract text from images using advanced OCR (EasyOCR).,3,image_path_or_url|languages|detail
research_ocr_extract,Extract text from images using Tesseract OCR.,2,url_or_path|language
research_onion_discover,Discover .onion hidden services related to a query using 5+ methods.,2,query|max_results
research_onion_spectra,Classify .onion site content by language and safety category.,3,url|fetch_content|max_chars
research_onionscan,Scan .onion service for misconfigurations and information leaks.,2,onion_url|timeout
research_open_access,Find free/open-access versions of academic papers.,2,doi|title
research_opencti_query,Query OpenCTI threat intelligence platform for indicator information.,3,indicator|indicator_type|opencti_url
research_optimize_resume,Analyze and optimize resume for ATS compatibility.,2,resume_text|job_description
research_optimize_workflow,Find optimal tool combination for research goal.,3,goal|available_tools|optimize_for
research_optimizer_rebuild,Force rebuild of auto-generated tool metadata cache.,0,none
research_orchestrate,Smart orchestration — automatically selects the best approach.,4,query|model|previous_attempts|previous_hcs
research_orchestrate_smart,Auto-discover; score; and execute optimal tools for ANY query.,3,query|max_tools|strategy
research_output_consistency,Measure LLM response variability by sending same prompt multiple times.,3,target_url|prompt|runs
research_package_audit,Audit package for supply chain attack indicators.,3,package_name|ecosystem|depth
research_packet_craft,Craft and send a network probe packet using Scapy.,4,target|packet_type|port|timeout
research_paddle_ocr,Extract text from image using PaddleOCR.,3,image_url|image_path|languages
research_paginate_scrape,Multi-page scraping with auto-pagination detection.,7,url|query|page_range|auto_detect_pattern|model|max_chars_per_page|timeout
research_paradox_immunize,Harden a system prompt against logical trick attacks.,1,system_prompt
research_parallel_execute,Execute multiple tools in parallel.,2,tools|timeout_seconds
research_parallel_plan,Determine parallel vs sequential execution plan.,1,tools
research_parallel_plan_and_execute,Plan and execute relevant tools in parallel based on goal.,2,goal|max_parallel
research_parameter_sweep,Test attacks at various API parameter combinations to find defense weaknesses.,7,prompt|strategy|model_name|sweep_type|dimension|max_combinations|max_concurrent
research_passive_recon,Map domain's hidden infrastructure using only passive techniques.,5,domain|check_ct_logs|check_dns|check_reverse_ip|check_tech_stack
research_password_check,Check if a password appears in known password breaches using k-anonymity.,1,password
research_patent_embargo,Detect M&A signals from patent filing patterns.,2,company|months_back
research_patent_landscape,Map the patent landscape for a technology.,2,query|max_results
research_pdf_advanced,Extract text; tables; metadata; and TOC from PDFs (PyMuPDF).,3,pdf_path_or_url|extract_images|extract_tables
research_pdf_extract,Extract text from a PDF URL.,2,url|pages
research_pdf_search,Search for text within a PDF.,2,url|query
research_pentest_agent,Invoke a specialized penetration testing AI agent with full methodology.,5,agent|target|task|scope|include_full_prompt
research_pentest_docs,Access pentest-ai-agents documentation and database schemas.,1,doc
research_pentest_findings_db,Access the pentest findings database schema and utilities.,2,action|finding
research_pentest_plan,Generate a comprehensive penetration testing engagement plan.,4,target|engagement_type|objectives|include_scope_template
research_pentest_recommend,Recommend pentest agents and approach for a given scenario.,3,scenario|current_access|include_agent_prompts
research_persona_profile,Cross-platform persona reconstruction from text samples.,2,texts|metadata
research_personalize_output,Rewrite research output to match reader's cognitive style and expertise.,4,content|audience|cognitive_style|expertise_level
research_phishing_mapper,Detect phishing campaigns targeting a domain.,1,domain
research_photon_crawl,Fast target-focused OSINT extraction via web crawling.,9,url|depth|timeout|extract_emails|extract_social|extract_subdomains|extract_files|extract_forms|max_urls
research_pii_scan,Scan for PII: email; phone; SSN; credit card; IP address.,1,text
research_pipeline_create,Create and store an ETL pipeline definition.,2,name|stages
research_pipeline_list,List all defined pipelines.,0,none
research_pipeline_validate,Validate pipeline definition.,1,name
research_plan_execution,Generate an execution plan for a research goal.,2,goal|constraints
research_plan_validate,Validate an execution plan for issues.,1,steps
research_plugin_list,List all loaded plugins with their metadata.,0,none
research_plugin_load,Load a Python file as a Loom plugin.,1,path
research_plugin_unload,Remove plugin from registry.,1,plugin_id
research_pool_reset,Reset all connections and stats.,0,none
research_pool_stats,Pool stats: databases list; total_active; max_connections; timestamp.,0,none
research_potency_score,Score prompt injection potency across 6 dimensions.,2,prompt|response
research_predatory_journal_check,Check if a journal shows signs of being predatory.,1,journal_name
research_predict_attacks,Predict likely attack vectors against a system prompt.,3,system_prompt|model|threat_level
research_predict_resilience,Predict how long an exploit will remain effective.,3,strategy|target_model|current_asr
research_predict_safety_update,Predict which safety defenses models will deploy next.,3,model|attack_category|time_horizon_days
research_predict_success,Predict attack success probability without API calls.,3,prompt|strategy|target_model
research_preemptive_patch,Preemptively patch a system prompt against predicted attacks.,2,system_prompt|predicted_attacks
research_preprint_manipulation,Detect preprint manipulation via timing analysis and social amplification.,2,arxiv_id|topic
research_privacy_score,Calculate overall privacy score for a given URL or the current system.,1,url
research_profile_hotspots,,1,top_n
research_profile_tool,,2,tool_name|iterations
research_prompt_analyze,Pre-analyze a prompt for danger level and recommend reframing strategy.,2,prompt|target_model
research_prompt_injection_test,Test a target LLM API for prompt injection vulnerabilities.,3,target_url|model_name|test_count
research_prompt_reframe,Reframe a prompt using research-backed techniques to improve LLM compliance.,4,prompt|strategy|model|framework
research_propaganda_detector,Detect propaganda techniques in text using NLP analysis.,1,text
research_provider_history,Show provider health history with uptime percentage and avg response time.,2,provider|hours
research_provider_ping,Quick availability check for providers. Returns config status + API key format validity.,1,provider
research_provider_recommend,Recommend best provider for task type based on availability and capability.,1,task_type
research_psycholinguistic,Analyze text for psycholinguistic patterns and threat indicators.,2,text|author_name
research_pydantic_agent,Create and run a pydantic-ai agent with type-safe response validation.,4,prompt|model|system_prompt|max_tokens
research_quality_score,Score response quality across 10 dimensions.,3,response|query|model
research_queue_add,Add a tool call to the execution queue with priority 1-10 (1=highest).,3,tool_name|params|priority
research_queue_drain,Dequeue up to max_items in FIFO order within priority. Execution is caller's responsibility.,1,max_items
research_queue_status,Get queue status: pending; processing; completed; priority breakdown; oldest age.,0,none
research_radicalization_detect,Monitor text for radicalization indicators.,2,text|context
research_rag_attack,Generate poisoned document chunks for RAG system injection.,3,query|attack_type|num_chunks
research_rag_clear,Clear RAG store. Returns: cleared; store_location.,0,none
research_rag_ingest,Ingest content into RAG store. Returns: chunks_stored; content_type; chunk_ids; store_location.,3,content|content_type|metadata
research_rag_query,Search RAG store. Returns: query; results; total_chunks; query_hash.,3,query|top_k|content_type
research_ransomware_tracker,Track ransomware group activity via threat intelligence sources.,2,group_name|keyword
research_ratelimit_check,Check if tool call allowed. Token bucket: N tokens/min; 1 token per call.,1,tool_name
research_ratelimit_configure,Set custom rate limit for tool.,2,tool_name|calls_per_minute
research_ratelimit_status,Show rate limit status for all configured tools.,0,none
research_realtime_monitor,Monitor multiple sources for recent mentions of topics.,3,topics|sources|hours_back
research_reasoning_exploit,Apply reasoning exploitation techniques to bypass safety.,2,prompt|technique
research_recall,Search persistent memory using LIKE matching.,3,query|top_k|topic
research_recommend_next,Recommend tools to use after a given tool.,3,last_tool|context|top_k
research_recommend_tools,Recommend relevant Loom tools based on a research query.,3,query|max_recommendations|exclude_used
research_reconng_scan,Execute recon-ng reconnaissance modules against a target.,3,target|modules|timeout
research_red_team,Generate and search for counter-arguments to a claim.,3,claim|n_counter|max_cost_usd
research_refusal_detector,Detect if a text is an LLM refusal response.,1,text
research_registry_graveyard,Scan package registries for deleted/yanked packages and typosquatting risks.,2,package_name|ecosystem
research_registry_refresh,Force re-scan all modules; update health status.,0,none
research_registry_search,Search the live registry with filters.,3,query|status|category
research_registry_status,Return live status of ALL registered tools.,0,none
research_reid_auto,Execute automated Reid 9-step interrogation with adaptive reframing.,5,query|model_name|max_turns|context|dry_run
research_reid_pipeline,Execute Reid 9-step psychological interrogation pipeline.,5,query|model|context|max_steps|dry_run
research_remember,Store research finding permanently in persistent memory.,4,content|topic|session_id|importance
research_resolve_order,Resolve task execution order using topological sort (Kahn's algorithm).,1,tasks
research_response_cache_stats,Return response cache statistics.,0,none
research_retraction_check,Check if papers/authors have retractions using Crossref and PubPeer.,2,query|max_results
research_reverse_image,Perform reverse image search across multiple engines.,4,image_url|image_path|engines|timeout
research_review_cartel,Detect peer review cartels via mutual citation patterns.,1,author_id
research_robin_scan,Scan dark web for threat actors; mentions; and OSINT via robin.,3,query|scan_type|timeout
research_robots_archaeology,Analyze historical robots.txt changes to find hidden paths.,2,domain|snapshots
research_route_batch,Route multiple queries with aggregated statistics.,1,queries
research_route_query,Route query to optimal tools via keyword matching against all tool docstrings.,2,query|intent
research_router_rebuild,Force rebuild tool index (call when new tools added).,0,none
research_rss_fetch,Fetch and parse an RSS/Atom feed.,2,url|max_items
research_rss_search,Search across multiple RSS feeds for items matching a query.,3,urls|query|max_results
research_run_experiment,Run controlled experiment: control vs treatments; measure effect size & significance.,4,hypothesis|variables|trials|metric
