tool_name,description,parameter_count,parameters
research_safety_circuit_map,Map safety circuits in an LLM via behavioral probing.,2,model|probe_type
research_safety_filter_map,Map safety filter boundaries of an LLM API.,2,target_url|categories
research_salary_intelligence,Aggregate salary data from multiple sources.,3,role|location|experience_years
research_salary_synthesize,Estimate salary using free public data sources.,3,job_title|location|skills
research_sanitize_input,Sanitize text input. Rules: strip_nulls; normalize_unicode; limit_length; remove_control_chars; strip_html; escape_special.,2,text|rules
research_save_note,Create a note in Joplin via REST API.,3,title|body|notebook
research_schedule_redteam,Schedule periodic red-team testing.,2,interval_hours|target_model
research_score_all,Score prompt + response on all dimensions (quality; danger; attack; prompt analysis).,4,prompt|response|strategy|attempts
research_screenshot,Take a screenshot of a webpage using Playwright.,3,url|full_page|selector
research_script_confusion,Script confusion: exploit weaker safety in non-Latin scripts.,2,prompt|target_script
research_search,Search the web using the configured provider.,9,query|provider|n|include_domains|exclude_domains|start_date|end_date|language|provider_config
research_search_discrepancy,Compare search results across multiple engines to find discrepancies.,1,query
research_sec_tracker,Track SEC filings for a company over the past 90 days.,2,company|filing_types
research_secure_delete,Secure file deletion with multi-pass overwrite (dry-run by default).,3,target_path|passes|dry_run
research_security_headers,Analyze HTTP security headers of a given URL.,2,url|domain
research_semantic_cache_clear,Remove semantic cache entries older than N days.,1,older_than_days
research_semantic_cache_stats,Return semantic cache statistics.,0,none
research_semantic_rebuild,Force rebuild the semantic index. Call after adding new tools.,0,none
research_semantic_search,Search tools by semantic similarity using TF-IDF vectors.,2,query|top_k
research_semantic_sitemap,Crawl a domain's sitemap; cluster pages by semantic similarity;,3,domain|max_pages|cluster_threshold
research_sentiment_deep,Deep sentiment and emotion analysis with manipulation detection.,2,text|language
research_session_close,Close a persistent browser session by name.,1,name
research_session_list,List active persistent browser sessions.,0,none
research_session_open,Open (or reuse) a persistent browser session.,5,name|browser|ttl_seconds|login_url|login_script
research_session_record,Record a tool call as part of a named session.,5,session_id|tool_name|params|result_summary|duration_ms
research_session_replay,Load and return the full session timeline.,1,session_id
research_shell_funding,Trace research funding through shell companies using OpenCorporates + SEC EDGAR.,1,company
research_sherlock_batch,Batch search multiple usernames across social networks.,3,usernames|platforms|timeout
research_sherlock_lookup,Search for a username across social networks using Sherlock.,3,username|platforms|timeout
research_shodan_host,Look up host information on Shodan.,1,ip
research_shodan_search,Search Shodan for devices matching a query.,2,query|max_results
research_silk_guardian_monitor,,5,check_usb|check_processes|check_mounts|trigger_action|dry_run
research_sitemap_crawl,Crawl website via sitemap.xml for comprehensive site coverage.,3,url|max_pages|use_js
research_slack_notify,Send research results to a Slack channel.,4,channel|text|thread_ts|blocks
research_smart_extract,Fetch URL with stealth browser + LLM-powered structured extraction.,6,url|query|model|max_chars|timeout|cache_key
research_smoke_test,Smoke test a single tool by importing and verifying it's callable.,1,tool_name
research_social_analyze,Analyze username across social media platforms.,4,username|platforms|timeout|extract_emails
research_social_engineering_score,Assess social engineering vulnerability from public data.,2,target|target_type
research_social_graph,Build a social relationship graph from public data across platforms.,2,username|platforms
research_social_profile,Extract public profile metadata from a social media URL.,1,url
research_social_search,Check if a username exists across social media platforms.,2,username|platforms
research_source_credibility,Rate source credibility using multiple factors.,1,url
research_spider,Fetch multiple URLs with bounded concurrency and per-fetch timeout.,14,urls|mode|max_chars_each|concurrency|fail_fast|dedupe|order|solve_cloudflare|headers|user_agent|proxy|cookies|accept_language|timeout
research_spiderfoot_scan,Perform reconnaissance on a target using SpiderFoot.,3,target|scan_type|modules
research_sso_configure,Configure SSO provider settings.,3,provider|metadata_url|client_id
research_sso_user_info,Extract user info from SSO token (JWT claims parsing).,1,token
research_sso_validate_token,Validate an SSO token (structure; expiry; signature format).,2,token|provider
research_stack_reframe,Stack multiple reframing strategies for maximum effectiveness.,3,prompt|strategies|model
research_stagehand_act,Execute browser instruction with vision-guided automation.,3,url|instruction|screenshot
research_stagehand_extract,Extract structured data from page matching schema using LLM vision.,2,url|schema
research_stealth_browser,Pure Patchright stealth fetch — no LLM extraction.,5,url|wait_for|screenshot|timeout|max_chars
research_stealth_detect,Estimate detectability of reframed prompts against known guardrail systems.,3,original_prompt|reframed_prompt|strategy
research_stealth_hire_scanner,Find hidden job opportunities not advertised on traditional job boards.,2,keywords|location
research_stealth_score,Score stealth of a reframed prompt to safety classifiers.,3,original_prompt|reframed_prompt|strategy_name
research_stego_analyze,Analyze text for hidden steganographic content.,1,text
research_stego_detect,Detect steganography and hidden data in text content or images.,6,content|image_url|check_whitespace|check_homoglyphs|check_lsb|check_exif
research_stego_encode,Describe steganography encoding (no image creation).,3,message|method|output_format
research_storage_dashboard,Get storage usage stats and alerts.,1,base_dir
research_strategy_log,Log a strategy attempt result.,5,topic|strategy|model|hcs_score|success
research_strategy_oracle,Recommend best strategies for attacking a specific model with a query.,3,query|model_name|top_k
research_strategy_recommend,Find best strategy for a topic+model combination.,2,topic|model
research_strategy_stats,Get overall statistics: top strategies; worst strategies; model performance.,0,none
research_stripe_balance,Get Stripe account balance.,0,none
research_structured_crawl,Crawl + extract structured data matching a CSS selector schema.,4,url|schema_map|max_pages|use_js
research_structured_extract,Extract structured data from text with guaranteed schema compliance.,5,text|output_schema|model|max_retries|provider_override
research_structured_llm,Get structured LLM output matching a schema using pydantic-ai.,4,prompt|output_schema|model|provider_override
research_stylometry,Analyze text for stylometric fingerprinting.,2,text|compare_texts
research_subdomain_temporal,Track subdomain births/deaths over time via Certificate Transparency logs.,2,domain|days_back
research_suggest_workflow,Suggest missing workflow steps based on tools already used.,1,tools_used
research_supercookie_check,Check if a domain uses supercookie and covert tracking vectors.,2,domain|timeout
research_superposition_attack,Generate superposed prompt variants and collapse to best.,3,prompt|num_superpositions|collapse_method
research_supply_chain_risk,Analyze dependency risk for a software package.,2,package_name|ecosystem
research_swarm_attack,Multi-agent attack coordinator with strategy sharing and social learning.,4,target_prompt|swarm_size|rounds|share_findings
research_synth_echo,Test AI model alignment by checking consistency across rephrased prompts.,2,model_name|test_prompts
research_synthesize_report,Synthesize multiple answers into a single coherent report.,4,question|answers|format|max_tokens
research_table_extract,Extract tables from PDF using Camelot.,3,pdf_url|pdf_path|pages
research_tag_cloud,Generate tag frequency cloud.,0,none
research_tag_search,Find tools by tag(s).,2,tags|match
research_tag_tool,Add tags to a tool for organization.,2,tool_name|tags
research_talent_migration,Predict researcher relocation from affiliation/timezone patterns.,2,person_name|field
research_target_orchestrate,Auto-select strategy chains to meet target scores.,4,query|targets|strategies_json|max_attempts
research_telegram_intel,Gather OSINT intelligence on Telegram public channels and groups.,3,query|channel|username
research_telemetry_record,Record tool latency after execution.,3,tool_name|duration_ms|success
research_telemetry_reset,Clear telemetry buffer.,0,none
research_telemetry_stats,Calculate p50/p95/p99 latency percentiles; grouped by tool.,1,window_minutes
research_temporal_anomaly,Detect temporal anomalies in a domain's infrastructure.,2,domain|check_type
research_temporal_diff,Compare current page content with Wayback Machine archived version.,2,url|max_cost_usd
research_tenant_create,Create tenant with isolated context and rate limit.,3,tenant_id|name|quota_calls_per_hour
research_tenant_list,List all tenants.,0,none
research_tenant_usage,Get tenant usage metrics.,1,tenant_id
research_testssl,Audit TLS/SSL configuration for vulnerabilities and weaknesses.,3,host|port|checks
research_text_analyze,Perform NLP text analysis using NLTK.,2,text|analyses
research_text_to_speech,Convert text to speech using Google Cloud Text-to-Speech.,4,text|language|voice|speaking_rate
research_thinking_inject,Inject reasoning into model thinking phase before safety filtering.,3,prompt|target_model|injection_point
research_threat_profile,Build a profile of an online identity from public OSINT sources.,4,username|email|check_platforms|max_platforms
research_token_split_attack,Token splitting: disrupt tokenization via Unicode tricks.,2,prompt|split_method
research_tool_catalog,Return full tool catalog with optional filtering.,2,category|capability
research_tool_dependencies,Analyze tool modules to find inter-tool dependencies.,0,none
research_tool_graph,Return complete tool connection graph.,0,none
research_tool_impact,Show what would break if a tool failed.,1,tool_name
research_tool_pipeline,Build optimal tool pipeline from research goal.,2,goal|max_steps
research_tool_standalone,Get complete standalone usage info for a tool.,1,tool_name
research_tool_version,Get version info for a tool or all tools.,1,tool_name
research_tools_list,List Loom tools filtered by category.,1,category
research_tor_circuit_info,Get current Tor circuit information (if Tor is running).,0,none
research_tor_new_identity,Request a new Tor circuit (exit node rotation).,0,none
research_tor_status,Check Tor daemon status and get current exit node IP.,0,none
research_torbot,Dark web OSINT crawling via TorBot subprocess.,2,url|depth
research_toxicity_check,Check text for toxicity across 8 categories with severity scoring.,3,text|compare_prompt|compare_response
research_trace_end,End a trace and record duration.,3,trace_id|status|result_summary
research_trace_start,Start a trace for an operation.,2,operation|metadata
research_traces_list,List recent traces with timing and status.,2,limit|operation
research_track_refusal,Track refusal rate per model in rolling 100-request window.,3,model|refused|strategy
research_training_contamination,Detect if model was trained on specific datasets.,2,target_url|dataset_name
research_transaction_graph,Build transaction graph from blockchain addresses via blockchain.info.,2,addresses|chain
research_transcribe,Transcribe audio/video from YouTube or direct URL using OpenAI Whisper.,3,url|language|model_size
research_translate_academic_skills,Translate academic CV language to industry terminology.,2,cv_text|job_description
research_trend_predict,Predict research trends by analyzing publication patterns.,2,topic|time_range_days
research_tts_voices,List supported Text-to-Speech voices.,0,none
research_unified_score,Score response on ALL available assessment dimensions.,4,prompt|response|model|strategy
research_urlhaus_check,Check if URL is listed in URLhaus malware database (free).,1,url
research_urlhaus_search,Search URLhaus by tag; signature; or payload hash (free).,2,query|search_type
research_usage_record,Record a tool usage event.,2,tool_name|caller
research_usage_report,Generate usage report for a specified period.,1,period
research_usage_trends,Show usage trends over a time window.,2,tool_name|window_hours
research_usb_kill_monitor,Monitor USB device connections and optionally trigger protective actions.,3,trigger_action|target_path|dry_run
research_validate_params,Validate params against schema. Schema: {"field": {"type": str; "required": True; "min": 1; "max": 100}}.,2,params|schema
research_validate_startup,Comprehensive health check on all registered tools.,0,none
research_vastai_search,Search for available GPU instances on Vast.ai.,3,gpu_type|max_price|n
research_vastai_status,Get Vast.ai account status (balance and running instances).,0,none
research_vercel_status,Get real Vercel platform status from official status page.,0,none
research_version_diff,Compare current version with a previous hash.,2,tool_name|previous_hash
research_version_snapshot,Take a snapshot of all tool versions for deployment tracking.,0,none
research_video_download,Download video or audio from YouTube; TikTok; Twitter; Instagram; etc.,4,url|format|audio_only|max_duration
research_video_info,Extract metadata from video URL without downloading.,1,url
research_vision_browse,Screenshot a URL and analyze with LLM.,2,url|task
research_vision_compare,Compare visual layouts of two URLs.,2,url1|url2
research_vuln_intel,Aggregate vulnerability intelligence from 6+ free sources.,2,query|max_results
research_vulnerability_map,Map model vulnerabilities and optimal exploitation strategies.,2,model|detail_level
research_wayback,Retrieve archived versions of a URL from the Wayback Machine (free).,2,url|limit
research_web_check,Comprehensive website OSINT analysis.,2,domain|checks
research_web_time_machine,Track website evolution via Wayback Machine CDX snapshots.,2,url|snapshots
research_webhook_fire,Fire webhook event to all registered listeners.,2,event|payload
research_webhook_list,List all registered webhooks.,0,none
research_webhook_register,Register webhook URL for task notifications.,3,url|events|secret
research_white_rabbit,Follow anomalies discovering non-obvious connections.,4,starting_point|depth|branch_factor|curiosity_threshold
research_whois,Run whois lookup on a domain.,1,domain
research_whois_correlator,Correlate WHOIS registrant across domains.,1,domain
research_wiki_event_correlator,Monitor Wikipedia edit patterns and correlate with news events.,2,page_title|days_back
research_wiki_ghost,Mine Wikipedia talk pages and edit history for contested knowledge.,2,topic|language
research_workflow_coverage,Report workflow coverage across all tools and categories.,0,none
research_workflow_create,Create workflow definition stored in SQLite.,2,name|steps
research_workflow_generate,Auto-generate workflows for given tool category.,2,category|max_steps
research_workflow_get,Get detailed workflow template definition.,1,name
research_workflow_list,List all pre-built workflow templates.,0,none
research_workflow_run,Execute workflow steps in dependency order.,2,workflow_id|dry_run
research_workflow_status,Get current status of workflow.,1,workflow_id
research_xover_matrix,Generate cross-model transfer probability matrix showing vulnerability transfer between families.,1,attacks
research_xover_transfer,Adapt attack from source to target models using transfer matrix & adaptation rules.,3,attack|source_model|target_models
research_yara_scan,Scan files for malware patterns using compiled YARA rules.,3,rules_path|target_path|timeout
research_zen_batch,Batch fetch multiple URLs concurrently with undetected browser.,3,urls|max_concurrent|timeout
research_zen_fetch,Fetch a single URL using undetected async browser (zendriver).,3,url|timeout|headless
research_zen_interact,Interact with a web page: click; fill; scroll; wait for elements.,3,url|actions|timeout
